religion,when people promote their religious beliefs as science they become nonsense
religion,42 20 37 -5 hannan buf 53 5 15 20 0
sports,this categorization of atheists as hostile towards religion is quite unfair
religion,to breath because kids get sick and die from tear gas
religion,24 16 95 -27 rumble ott 68 3 13 16 0
sports,he got pinch hit for  and didn't play against baltimore tonight
religion,the quick answer revelation 127-9 and there was war in heaven
sports,the giants took the second game however by a 6-2 score
sports,in reality though you have to acknowledge that scientists are human
religion,but these are unusual -- few churches permit homosexual church leaders
sports,i'm nearly contridicting myself with the mish-mash of knowledge i've gleaned
religion,i'd like to know who's mask you think looks the best
religion,37 19 59 -4 hatcher min 65 4 15 19 0
religion,you can't allow five goals like we did that's not right
religion,certainly you would want your husband to be faithful to you
religion,50 18 25 4 foligno tor 54 13 5 18 0
religion,actually fired-coach george kingston was a third of the gm triumvirate
sports,for this must take place but the end is not yet
sports,i suppose it depends on your notion and definition of faith
sports,the entire business of a bank is the management of risk
religion,someone posted a list of x number of alleged bible contradictions
religion,chalcedon was a compromise between two groups the alexandrians and antiochenes
religion,for it is by grace you have been saved through faith
sports,mark only the colt was called for and brought to jesus
sports,327 1991 ric 129 30 5 2 4 7 11 3
sports,i only caught the tail end of this one on espn
sports,i think that domestication will change behavior to a large degree
religion,this root words is included in words which denote a transition
religion,21 3 6 -11 walter van 23 3 0 3 0
sports,in the realm of christianity man was created in god's image
religion,i see little respect eminating from the god of the bible
sports,so i suppose there are some disadvantages to that idea too
religion,68 50 34 28 eklund phi 52 11 38 49 0
sports,ftp is a a way of copying files between networked computers
religion,gerald people still have an axe to grind with this guy
sports,and under american law they deserved a jury of their peers
religion,note that the passage isn't about homosexuality -- it's about  idolatry
sports,0 3-5 won 1 03-03 00-02 los angeles dodgers 03 07
religion,i don't intend to carry an entire discussion crossposted from alt
religion,van hellamond can not be faulted for the leafs demise either
religion,this is the everlasting life that the new testament speaks of
religion,03 2 42 0 joseph stl 66 0 2 2 0
religion,13 88 54 23 bellows mon 80 40 48 88 1
sports,new fossils are found often enough that this is tested regularly
sports,that wouldn't do well for his popularity in the local circles
religion,plus- after 1 year of full-time service they will reimburse tuition
religion,22 5 18 -9 wolanin que 23 1 4 5 0
sports,now this claim would be arrogant but atheists don't claim it
religion,bury 68 25 19 bruce's rented mules 68 25 4 41
religion,20 2 12 -9 osborne tb 11 1 1 2 0
religion,ra ra welcome to the wonderful world of mormon paradoctrine robert
religion,33 23 92 -2 krygier was 74 11 12 23 0
religion,these were male prostitutes having men or women as their objects
religion,again this issue isn't one of the abolition of the law
religion,out for nirvana which is not at all the same thing
religion,sin can be tough to over come especially without supernatural power
religion,trying to set up a goal should be first and foremost
religion,who else in this world is claiming to be the messiah
religion,the other question is about the concept of religion in bible
religion,protestants love to play up jerome for all he is worth
sports,a good library or a bookstore is a good starting point
sports,no but really only because you have a smaller sample size
religion,stowell seems to have jumped rather strangely from truth to absolutes
religion,27 4 36 -4 picard sj 25 4 0 4 0
sports,i don't follow this newsgroup so e-mail responses would be ideal
religion,19 94 75 9 jagr pit 80 34 60 94 1
sports,deion sanders hit a home run in his only ab today
religion,no linesman no shot for bretti can redirect anythinghull to redirect
sports,is at the very best quite disingenuous and perhaps even dishonest
religion,crowley and lewis were very different persons as you probably know
religion,the atheist position seems to be that there are no authorities
sports,pitchers can only walk clark with 2 outs unlike last year
religion,so why is the team moving to a city in texas
religion,on the other hand neither do the gospels prove your faith
religion,33 4 4 -3 hervey tb 15 0 4 4 0
religion,19 11 52 9 kasper tb 66 4 7 11 0
sports,once more atheism is characterised by lack of belief in deities
religion,why should i even bother to change or disprove your beliefs
sports,that's what i mean when i say there's no objective physics
religion,great skater and hard shot though wish he were more accurate
religion,this leads to the problem of defining morality for our society
religion,louis and is now pursuing doctoral studies at yale divinity school
sports,the shrinkage of the strike zone didn't start until the mid-70s
religion,we were having intermittent problems with our mail at the time
religion,to tell you the truth i don't know much about islam
sports,penn state is just loaded to the hilt with bible bangers
sports,mormonism is both puritanical in moral outlook and evangelical in preachment
sports,ben mcdonald rich delucia and the rest of the mariner bullpen
sports,jayson stark i trhink that's him fits perfectly in this category
religion,there is no yzerman-fedorov-probert line except for maybe on a powerplay
religion,86 64 117 19 zelepukin nj 76 23 41 64 0
religion,soderstrom plays with philly but he doesn't have a moulded mask
religion,different people are at different levels of development in different areas
religion,49 36 98 4 sjodin min 75 7 29 36 0
religion,01 81 112 -1 lebeau mon 69 31 49 80 1
religion,one can say that the apocrypha are not quoted by christ
religion,so have fun and remember that flaming can be considered slander
religion,09 2 10 0 whitmore van 29 0 2 2 0
religion,of what interesting things if any does the text provide evidence
religion,can the churches also decide what is and is not sin
religion,38 21 34 -1 lindberg cal 61 9 12 21 0
sports,disk ii and we need the stats for the 1992 season
sports,you stated it better and in less world than i did
religion,one of the lousiest periods i've seen sweden play this year
religion,08 1 30 7 gosselin har 15 0 1 1 0
religion,and emotional feelings are a totally deceiving indicator for religious validity
religion,20 16 168 3 odelein mon 81 2 14 16 0
religion,this is equivalent to my counter-question why nothing exists in nothingness
religion,05 3 107 4 ranford edm 66 0 3 3 0
religion,his patented wrist shot will put some numbers on the board
religion,58 7 21 -2 quintin sj 14 2 5 7 0
sports,any information on either of the players would be greatly appreciated
religion,in the new testament the word used for this is charity
religion,i lost a lot of respect for potvin because of that
religion,i don't often remember dreams that i don't chose to have
religion,06 85 70 3 cassels har 81 21 64 85 1
religion,i would argue gerald that bowman is the first modern coach
religion,you're only looking at the surface at the way of argumentation
religion,i'd like to see a game in the norris or smythe
sports,6 billion years old and has had life for about 3
religion,84 70 45 18 kovalenko que 80 27 41 68 0
sports,he's going to be one of colorado's better players this year
religion,awareness is only part of what makes a member of society
religion,00 0 0 -3 wamsley tor 3 0 0 0 0
religion,i'm sick of seeing teams pulling guys down holding guys etc
religion,specifically for your convenience i want to know about the  1
religion,i don't view makarov as a player who would add toughness
sports,271 1990 int 85 26 7 1 1 14 8 1
religion,i have a strong and stable sense of morals and values
religion,42 27 21 -4 odgers sj 65 12 15 27 0
religion,32 21 65 -20 gilchrist min 68 10 11 21 0
religion,so other forbidden sex acts are a valid topic for conversation
religion,'' by killing a madman hell i'll kill ten a day
sports,the current unforms are dull and the new ones sound horrible
sports,once in college and the topic of mormon archeology came up
sports,towards both a mechanical engineering  so are my ideas & opinions
religion,maybe he is giving a message by the lack of one
sports,there's a lot of whining about how much players are overpaid
religion,maybe tommy told them that he was getting bored back there
religion,i'm just going to tug on two threads in message-id may
religion,i'm really sorry roger but you have lost me completely here
sports,limit the extent to which previous posts are reproduced in posts
sports,this is something known only by the person him/herself and god
sports,i think it is a very normal decision to have made
religion,70 52 150 2 kontos tb 66 27 24 51 0
religion,27 17 103 22 macdermid was 72 9 8 17 0
sports,he was considered a blasphemer and troublemaker all throughout his career
religion,don't follow the preacher because of such statements that come true
sports,this prophecy is an utterly gross bastardisation of old testament scripture
religion,is this what they teach you in business school in canada
religion,96 79 49 -2 brown stl 69 25 53 78 1
religion,nyi - pit in 5 nyi wins fourth game was vs
religion,the borg 42 25 -- dave wessels 42 25 -- 4
sports,cummings can see this would he drop me a short note
religion,00 0 6 0 knickle la 10 0 0 0 0
religion,22 100 88 15 francis pit 83 24 76 100 1
religion,man to come into being out of a purely impersonal cosmos
sports,the statement is arguing from the assumption that jesus actually existed
religion,48 21 37 -1 sillinger det 51 4 17 21 0
religion,58 34 22 20 guerin nj 63 14 20 34 0
religion,this was not a loss because of poor goaltending or officiating
religion,the arena is under construction and will be completed in june
religion,42 20 34 14 druce win 48 6 14 20 0
religion,heaven and hell are good motivators at certain stages of maturity
religion,if it were not for her we would not be saved
religion,so are the islanders but they can still pull it out
sports,anyway i want to find ap out how widespread this is
religion,35 29 30 6 falloon sj 41 14 14 28 0
sports,such methods are used all the time to lie with statistics
religion,i think that the flames and the flyers traded captains once
sports,507 1990 kcr 405 110 17 1 27 44 16 9
sports,5 4-6 lost 4 04-02 00-04 kansas city royals 03 09
religion,what are the consequences of the homophobic ranting of the self-righteous
religion,speaking of roger and ilk whatever happened to good ol' gln
religion,91 73 60 -1 nedved van 82 38 35 73 0
sports,2 152 103 193 10 28 7 1 5 drabek 2
religion,luke 1911-27 how you spend time determines how you spend eternity
religion,41 21 16 0 volek nyi 56 8 13 21 0
religion,do you believe that the computer terminal you are using exists
sports,6% out making ability how many extra hits would go by
religion,thanks for your time and keep on sending in those votes
sports,hey it might to interesting to read some of these posts
religion,--clh i'd suggest that more than some qualms are in order
religion,krupp is now playing for the islanders after the lafontaine/turgeon trade
religion,the world is dying and needs to hear about jesus christ
religion,i think it was four go ahead and refresh my memory
religion,from a long article available through an individual on this newsgroup
sports,people can decide whether or not to have  children and when
religion,s having nothing to do with hockey he would be better
sports,lucky for them that the baby didn't have any obvious deformities
religion,look at satan's twist of god's word when he coerced eve
religion,the change to snow also proved the difference in the end
sports,opposing pitchers don't want to    walk williams to get to bonds
sports,thus seen as a trustworthy and honorable soul she was believed
religion,i am speaking in general terms here not specifically about homosexuality
religion,24 10 28 -18 debrusk edm 49 8 2 10 0
religion,00 0 11 -2 agnew har 16 0 0 0 0
religion,because everyone knew that she had been taken up into heaven
religion,48 39 60 3 kurvers nyi 49 8 30 38 0
sports,if there were other ways of getting around i'd do it
religion,i watched the game hockey is much better than no hockey
sports,the red sox can use chinese women swimmers as a reference
sports,636 -- 6-4 won 2 04-01 03-03 houston astros 06 04
religion,19 14 191 7 bergevin tb 76 2 12 14 0
sports,the difference is often how far they will follow their beliefs
religion,91 74 6 -18 richer nj 76 38 35 73 0
religion,but we shouldn't water down the gospel to draw people in
religion,i boycotted espn's morning sportscenter today i was still so incensed
religion,this is in fact mary's soul already with christ in heaven
sports,0 3-6 won 1 02-04 01-02 american west won lost pct
religion,those are the ones traditional enough to have funny names anyway
sports,you are proposing to punish people before they commit a crime
sports,for example it is perfectly acceptable to kill animals for food
sports,it is not just because some unnamed mediot made the characterization
religion,ed belfour chicago 8 4 andy moog boston 8 3 3
religion,15 9 191 -5 lalor win 62 1 8 9 0
religion,having experienced god i try to make sense of that experience
religion,37 20 12 -20 bourque nyr 54 6 14 20 0
religion,i shall appreciate both quotes from the bible and historical development
religion,bourke also directed the nt translation in the new american bible
sports,0 7-3 lost 1 04-02 03-01 new york mets 05 04
sports,not a scientific  study but it'll show the truth for matt
sports,727 -- 7-3 won 2 04-02 04-01 california angels 06 04
religion,yes even bad things may be used by god for good
religion,the period ends and the sportscaster capitols just tied it up
religion,00 0 0 -2 cote tb 2 0 0 0 0
religion,27 6 7 -11 shuchuk la 23 2 4 6 0
religion,whenever my 'personal interpretation' is questioned i usually give a reason
religion,even espn could've sold second rights to third party systems i
sports,if bobby does see this let him address this question also
sports,strawberry's demeanor as represented by the media often sounds like demands
sports,edward said by the way is a christian not a muslim
religion,however i can sympathize with the person who published the prophecy
sports,perhaps in 2004 they'll be as reliable as an average sdcn
sports,and as i'm sure others will tell you read the faq
sports,does anyone know if koresh has requested that it be wordperfect5
religion,54 35 38 -1 zezel tor 68 12 23 35 0
religion,significantly moses prays that they will be satisfied with his love
religion,02 84 73 42 bourque bos 78 19 63 82 1
sports,don't you find the fact that they don't at all significant
religion,if it's too traumatic they never recall why they were punished
sports,i think the ugliset stance is jolio franco of the ranger
religion,this implys that mind is more than merely a biological phenomenon
sports,but it still pops up from time to time even today
religion,the last sentence is ironic since so many readers of soc
religion,05 2 4 0 healy nyi 46 0 2 2 0
sports,at my summer camp where i work my boss is gay
sports,gb last 10 streak home road san francisco giants 06 04
sports,atheism tends to attract evangelical christians looking for someone to convert
religion,29 8 28 6 mcdonough sj 30 6 2 8 0
religion,you trut the federal gevernment to give us a clean slate
religion,when denis savard is your team's enforcer there's big trouble someplace
religion,to become god not in his essence but in his energies
sports,i mean please don't tell me how to run my business
sports,besides the point's not to die for what one believes in
religion,65 137 44 33 turgeon nyi 80 58 74 132 1
religion,04 2 25 0 hextall que 53 0 2 2 0
religion,10 5 26 -7 pedersen har 58 1 4 5 0
sports,2 166 55 131 16 29 4 0 2 tewksbury 3
sports,0 172 42 97 8 27 1 0 2 farr 0
sports,indeed you have struck right at the heart of our disagreement
religion,you don't have any more or better truths than anyone else
religion,this inlcludes all the current flavours of roughing fighting and boarding
sports,- i was at least close and was right about jefferies
religion,if there are things which don't fit how significant are they
sports,but for a predictive calculation i thought this did pretty well
sports,let's look at the effects of inflation on 1930's superstars' salaries
religion,you have been sold a bill of goods on bob gainey
religion,it reminds me a bit of the 1910 presbyterian general assembly
religion,'' but when they mentioned `king' and `caesar' his heart froze
sports,mary virgin or not was indeed a young woman with child
religion,saying that hurting a player will solve anyone's problems is asinine
religion,38 109 240 28 roenick chi 82 50 57 107 1
religion,they slay the widow and the alien; they murder the fatherless
sports,to what extent do you think science has influenced your beliefs
sports,2 by defining the good solely in terms of evaluative terms
religion,31 24 103 2 ozolinsh sj 37 7 16 23 0
religion,38 26 124 16 lamb ott 69 7 19 26 0
sports,i'm praying that the bp will return to last year's form
religion,tounges as a prayer language finds support in i corinthians 1414-18
religion,obtained defenseman dan ratushny from winnipeg for a ninth-round draft pick
religion,i know next to nothing about irving and nothing about funk
religion,representations of jesus as black or korean or whatever are fine
religion,new rules and a new referee system need to be instituted
sports,the last several flame-wars with him have been pretty much identical
religion,obviously the three-fold baptismal formula is biblical as you point out
religion,i seriously doubt god could have an answer to this question
religion,38 20 41 10 corriveau har 54 8 12 20 0
religion,00 0 0 0 cloutier que 3 0 0 0 0
religion,all kjell could do at 8'7 and 355 pounds was laugh
sports,those that are not in favor should work to convince others
sports,i don't really see why we should shoot him for that
religion,is anyone interested in explaining a bit about the conservative viewpoint
sports,i don't have the stat book so let's throw them out
religion,well the patrick division got a little more interesting last night
religion,43 17 24 -20 nattress phi 44 7 10 17 0
sports,does the bush campaign have an official response to this filing
sports,-dawson and vaughn hit i think hrs early in the game
sports,that's your perhaps colored by your partisanship of the braves perception
religion,i dare say all of us would be walking into walls
sports,i think there will be some with other teams as well
sports,of course oversimplifying any moral argument can make it seem contradictory
religion,maria goretti posted two weeks ago i am a bit confused
religion,86 54 65 9 bodger buf 80 9 45 54 0
religion,38 16 10 13 murphy bos 48 5 11 16 0
religion,42 23 26 -9 ashton cal 56 10 13 23 0
religion,out of curiousity i checked the final standings today on r
sports,c lavalliere's release had nothing to do with him being through
sports,lance parrish hitting for boone was walked and bruce sutter entered
religion,00 0 10 0 terreri nj 47 0 0 0 0
religion,he defiled the valley rendering it ceremonially unclean 2 kings 2310
sports,000 -- 1-0 won 1 00-00 01-00 milwaukee brewers 00 00
religion,of course bezae is quite bizarre in the gospels as well
religion,i suppose you treat both with equal truthfulness or equal falsity
religion,it's more like i think therefore i am therefore god is
religion,09 2 14 -6 nylund nyi 22 1 1 2 0
religion,14 9 202 -9 kocur nyr 64 3 6 9 0
sports,a world creator god does the moment it creates the world
religion,18 2 8 -1 wood sj 12 1 1 2 0
sports,however the cardinals refused to give up winning 6-2 on sunday
religion,38 30 110 -15 buchberger edm 81 12 18 30 0
religion,85 52 59 14 ward van 68 22 30 52 0
sports,sometimes is just something else more interesting that occupies your mind
religion,03 1 2 0 billington nj 40 0 1 1 0
religion,far more independent evidence would be required to validate your claim
religion,he couldn't hit a bull in the ass with a banjo
sports,i believe he began this year in aa which is albany
religion,31 13 69 2 lindsay que 44 4 9 13 0
sports,it's vastly better than it was before they fixed it though
sports,how did you know i was going to welcome you abord
religion,cops are not cops until they identify themselves as police officers
religion,romans 51-11 life with christ is difficult; without him it's hopeless
sports,why are there churches to the square inch in my country
sports,there are so many one true religions it's hard to tell
sports,faith in god is a belief and all beliefs may change
religion,remember this is all long before there was a ritual law
religion,the theory of evolution does not provide facts; it explains facts
religion,99 79 70 22 hatcher was 80 34 45 79 0
religion,cbc always gets plenty of complaints about juggling the news schedule
sports,however the beliefs say they are more than a work hypothesis
sports,the formula for dcon appears at the end of this article
religion,21 5 4 -7 prokhorov stl 26 4 1 5 0
religion,and frankly speaking = i don't care life is fun anyway
religion,19 11 219 6 dahl cal 59 2 9 11 0
religion,whosoever resisteth the power resisteth the ordinance of god rom 131-2
religion,47 28 122 2 carpenter was 65 11 17 28 0
religion,what's it like at divinity schools or seminaries in the states
religion,one thing that somewhat worries me is a question of methodology
religion,22 15 78 -4 butcher stl 82 5 10 15 0
religion,abortion is done because the mother can not afford the pregnancy
sports,407 1990 nyy 133 21 2 2 3 13 8 2
sports,do i go by the imam of the mosque in mecca
religion,total dedication to this course of action is required romans 121-2
religion,i know all too well how they can be very time-consuming
religion,this is aptly expressed by the current 117th successor of st
religion,16 4 24 -17 reese cal 25 0 4 4 0
sports,and morality can be thought of a large class of princples
sports,has there been any player of both pro hockey and baseball
religion,i also passed the list through with the goalies still included
religion,32 20 116 -14 johansson cal 75 4 16 20 0
religion,25 19 203 4 beukeboom nyr 79 2 17 19 0
sports,joh 1827 peter then denied again and immediately the cock crew
sports,625 -- 5-3 won 5 00-03 05-00 atlanta braves 06 04
sports,cincinnati trailed 2-0 after starter tim pugh blinked in the fifth
religion,and think of where the majority of hockey players come from
religion,korean war - political expansionism by north korea basically communism vs
religion,19 37 14 13 numminen win 65 7 30 37 0
sports,so why does every newspaper rank team offense by batting average
religion,i'm still trying to determine if he is kidding or not
religion,they had no intent of raiding the us government or anything
religion,i think the same sort of reasoning applies in this case
religion,39 31 109 4 yushkevich phi 79 5 26 31 0
religion,for god must give enough grace to all to be saved
sports,east is back to where it was in the early eighties
religion,that doesn't mean that the same people would accept those substitutions
religion,i live in fear of what will happen when i die
religion,in all thi ngs she did the holy will of god
religion,babylon's sin affected or should i say infected the whole world
religion,this involved a gradual dimming of  consciousness of the spiritual world
religion,01 78 90 -15 craven van 76 25 52 77 1
religion,it's ok to follow and be concerned about your home team
religion,i have characterized science/creation science as rationalism/nonsense and that it is
religion,that one should love one's neighbor is a purely christian principle
religion,74 60 20 4 shannon win 82 20 40 60 0
religion,32 24 108 9 berg tor 78 13 11 24 0
religion,no doubt many will have to chew on this one awhile
religion,06 3 8 0 marsh ott 57 0 3 3 0
religion,21 16 129 26 may was 80 6 10 16 0
religion,25 1 2 0 macdonald buf 4 1 0 1 0
sports,not the age of the universe anyway as i show  above
religion,close roger but no banana er avocado or is it artichoke
sports,response american atheist press publish an atheist's handbook detailing biblical contradictions
religion,mcconkie rightly stated salvation comes only by worshiping the true god
religion,he noted that the offices for the league are in spring
sports,the idea was to get the giants to move into shea
sports,but you probably like me seem to be a soft atheist
sports,383 1989 int 263 70 11 4 6 18 15 6
religion,you seem to believe that steel melts somewhere around 1000 c
sports,i have a picture of lavey with sammy by the way
sports,still it ought to be a pretty decent home run park
religion,00 0 68 3 waite chi 20 0 0 0 0
religion,at the 7-minute mark canada started applying pressure on the swedes
religion,however amongst the persecuted churches these prayers are much more common
religion,my friends teenage kids do not like to go to church
religion,in my opinion you can be an atheist and a buddhist
religion,00 0 0 0 o'connor nj 7 0 0 0 0
religion,some people have argued that aids is a judgement against homosexuality
