religion,sometimes it pays off clicking away on your cable-tv remote control
religion,there needs to be some degree of mutuality in decision making
sports,since this is now dated however don't feel compelled to respond
religion,44 24 62 0 brady ott 55 7 17 24 0
religion,i hope you don't mind if i say amen to this
sports,here's to the red sox who contributed to last night's victory
religion,in larson's theory mass stays constant and force drops toward zero
religion,third period 6 st louis shanahan 1 brown hull pp 1112
religion,28 17 65 5 kasatonov nj 63 3 14 17 0
religion,and remember that epicycles crystal spheres geocentricity flat earth theory etc
sports,or maybe it is simply improving his mechanics - i dunno
religion,i felt guilty for some of my own personal honest feelings
religion,this was one of his main problems when playing for buffalo
religion,52 15 16 7 archibald ott 42 9 6 15 0
religion,22 17 20 -15 cavallini was 79 6 11 17 0
religion,rev 20 and 21 talk about the eternal fire as well
sports,321 hayes 3b 25 7 1 2 5 2 1 2
religion,that is lutheran traditions but trying to keep an open mind
sports,now of course this prediction involves quite a bit of error
religion,could they not have/enjoy heterosexual relations for what it was worth
sports,i should clarify what muslims usually mean when they say muslim
sports,480's so is winny's i would like to see your facts
sports,ok but in that case why are you posting about it
religion,the primary problem in human nature is a fragmentation of being
religion,the god of peace will soon crush satan under your feet
religion,00 0 12 0 tugnutt edm 25 0 0 0 0
religion,43 25 43 6 stern cal 69 10 15 25 0
religion,but let's look at some of sinden's trades over the years
sports,i'm a season ticket holder and have a pair of s
religion,can someone who is more knowledgeable about the trinity enlighten us
religion,many prophets prophesied prophecies which were not recorded in the scriptures
sports,went to the dodgers game tonight -- it was cap night
religion,stauber acknowledged he played poorly in the four games melrose mentioned
religion,64 27 18 7 ferraro nyi 43 14 13 27 0
religion,there are groups descended from both of the supposedly heretical camps
sports,i'm just amazed that people still try to use this argument
religion,i use the top of the stairs when they're really young
religion,all i hear here is the a priori i mentioned before
religion,18 97 96 5 hawerchuk buf 79 16 80 96 1
religion,72 49 52 -1 semenov van 74 12 37 49 0
religion,05 2 7 0 soderstrom phi 43 0 2 2 0
sports,suppose the pitcher uses up n-1 of his n pick-off attempts
religion,49 27 32 3 plavsic van 56 6 21 27 0
sports,250 clark lf 37 9 3 1 1 3 3 1
sports,he was one of the best athletes evr to play baseball
religion,he won 2 of 3 decisions but had a bloated 5
sports,some atheists believe that asking what is the meaning of life
religion,i recommend that you do some appropriate reading in general science
religion,the latin has feminine forms only by an accident of grammar
sports,-this year's draft seems to have gone well for the pirates
religion,24 16 61 -26 stanton pit 76 4 12 16 0
religion,however the word paques in french is the word for easter
sports,of course i'm not a lawyer so i could be wrong
religion,16 80 20 23 roberts cal 57 38 41 79 1
sports,but what we know has no effect on an objective system
religion,and i was astonished about the behaviour of the german audience
sports,same with moral values values at all worth measuers and usefulness
sports,pmy atheism is incidental and the question of god is trivial
religion,if it is these two calgary will not need six games
religion,i understand that similar ceremonies written in slavonic exist as well
religion,58 36 70 -24 reid bos 65 20 16 36 0
sports,but maybe that's because the supply of natural 3b is scarce
sports,you have certainly not shown this; you have merely stated it
religion,14 8 154 -7 wilkinson sj 58 1 7 8 0
religion,it sounds a lot like what the jews were looking for
sports,why aren't my catholic neighbours out killing the protestants for example
sports,' to study the products yes but not to generate them
religion,49 37 196 -2 graham chi 82 20 17 37 0
religion,09 1 2 0 karpa que 11 0 1 1 0
religion,10 8 105 -4 eastwood tor 12 1 6 7 0
religion,00 0 10 0 charron mon 3 0 0 0 0
religion,bernie nichols was interviewed after game 2 on the late news
religion,now let's go to the discussion of baptism and original sin
religion,through the disobedience of each individual each was made a sinner
religion,00 0 0 0 hamr ott 3 0 0 0 0
sports,the article was titled `giraffe' sticks scientific neck out too far
sports,i am now about to post it under the heading bcci
religion,the best way to love someone is to pray for them
religion,quebec got a pick detroit got 4 but absolutely no chicago
religion,84 53 44 5 turcotte nyr 68 25 28 53 0
religion,28 18 30 -17 daigneault mon 65 8 10 18 0
religion,we are doing a bible study at my college on revelations
religion,79 62 151 15 ysebaert det 79 34 28 62 0
sports,it's not clear to me at all that this is true
sports,the dodgers as a team paid a big price that season
sports,i have made this clear elsewhere but will do so again
sports,and the ks don't have to denote a slow game either
religion,00 0 2 0 tabaracci was 23 0 0 0 0
religion,samuelsson barrasso sh 1741 2nd period pit tocchet 2 - k
religion,29 5 33 -14 byers sj 18 4 1 5 0
religion,this would deprive the people of the see of a shepherd
sports,this talk about the phillies winning the nl east is scary
religion,let's look at what the bible has to say about it
religion,and take away bob probert and the wings are dead octopuses
sports,0 6-4 lost 3 04-02 03-03 new york mets 06 05
religion,10 3 0 0 wakaluk min 29 0 3 3 0
religion,36 27 158 7 korolev stl 74 4 23 27 0
religion,we first look to the bible to see what it teaches
sports,267 and then vaughn who has the team's only hr at
sports,44 era 6 saves gary wayne l 147 games 8-8 3
religion,30 3 4 0 morris sj 14 0 3 3 0
religion,in 1972 the congregation ordered a larger building to be constructed
religion,however there are those who use the church to bolster themselves
sports,atheism community tells  me to stop or i get totally bored
religion,that's what the verse taken from 2 timothy was all about
religion,88 72 60 15 mullen pit 71 33 37 70 0
sports,it certainly seemed to me that there was excessive force involved
religion,carson went off at 1453 and the flames failed to convert
religion,furthermore the church has always taught predestination from the very beginning
religion,he was seriously unimpressive even as a tough guy his rep
religion,that is the question which you have not answered from scripture
religion,75 57 212 13 elynuik was 77 22 35 57 0
religion,unfortunately it is not entirely clear what the words actually mean
religion,26 20 163 29 podein edm 38 13 6 19 0
sports,on september 1 1964 this was the top of the n
religion,when the hawks skated they outskated the blues and took control
religion,for those who like contrary questions nb i was not there
sports,but possibly the cause and effect is the reverse of that
sports,and if this were an argument for objectivism you'd be right
religion,at any rate there's no debate that homosexual rape is wrong
religion,however bede's is not the only theory that has been proposed
religion,22 96 48 -14 shanahan stl 69 51 43 94 1
religion,66 49 32 16 davydov win 77 28 21 49 0
religion,the wording implies to me that this was a normal meeting
religion,on the second day after christmas my truelove served to me
sports,yes runs are the most important statistice -- for a team
sports,but for the moment we will just look at one verse
religion,even when i was alive here on earth they refuse me
religion,mike was the original devils tv play-by-play announcer by the way
religion,well some teams such have it and some teams just don't
religion,they are 2 peter 120-21 2 timothy 316-17 and galatians 111-12
religion,until his gifts there were no zoroastrian temples on this continent
religion,stone towers known as dakhmas were built especially for this rite
religion,00 1 0 0 ratushny van 1 0 1 1 1
religion,i explained it but left justification up to our catholic readers
religion,77 46 36 -14 hawgood phi 66 11 35 46 0
religion,it's right outside of akron in the northeast part of ohio
sports,morris' career numbers are quite good and worthy of hof consideration
religion,the islanders lost in ot and the devils tied the pens
religion,the reasoning that i mentioned before is freud's ego i suppose
religion,on the other hand jd is a pompous bull-headed arrogant know-it-all
sports,my opinion fwiw to all mark age doesn't matter; ability does
religion,i have found several good christian metal groups that i like
sports,but you have been courteous and therefore received courtesy in return
religion,10 1 6 -5 draper buf 11 0 1 1 0
sports,ugliest stance of all time has to go to oscar gamble
religion,00 0 0 0 d'alessio har 1 0 0 0 0
sports,moral relativism means that there is no objective standard of morality
religion,could the verses you cite be refuted by interpreting them differently
sports,as i said before i expect that this effect is disappearing
sports,therefore you choose to punish only those who talk about it
religion,this statement inherently suggests that we are not already like christ
religion,44 35 74 18 donato bos 81 15 20 35 0
religion,non-christian; there is a whole spectrum of belief systems within christianity
religion,44 114 96 19 stevens pit 71 55 57 112 1
religion,42 13 14 -2 reekie tb 42 2 11 13 0
religion,our outrage at evil is too often just a cheap shot
sports,so which one will officially be the end of the world
sports,the above data is for a 4-year period ending last season
religion,43 31 24 21 smehlik buf 78 4 27 31 0
sports,the next problem is the sticky question of what is colour
religion,how would one go about confirming the truth of this hypothesis
sports,5 5-4 lost 1 02-01 03-03 los angeles dodgers 03 06
religion,27 7 13 -5 murray bos 27 3 4 7 0
religion,51 35 24 -1 burr det 79 10 25 35 0
religion,if you asked me 30 days ago i'd agree with you
religion,the simulation of the death of people was a wonderful game
religion,51 40 94 -22 niedermayer nj 78 11 29 40 0
sports,nowhere does this definition imply that one cannot change one's mind
religion,why not have back to back nights of national hockey night
sports,l's stats unless you know both right and left -handed stats
religion,47 36 76 -10 borsato win 65 15 20 35 0
religion,well since you're a pens fans the whole question is moot
religion,for me i've often found it hard to tell the difference
sports,read orientalism by edward said -- see the evidence for yourself
religion,as you can see i have to telent to get rec
religion,everything else he says on sex is consistent with that background
religion,it was a part of peter's tradition and not the scripture
religion,they felt that they were the remnant spoken about in revelation
religion,i saw messier and leetch shooting at a camera on letterman
religion,00 0 6 0 fuhr buf 56 0 0 0 0
religion,yet they all died in their sins in the christian sense
religion,i guess all i can do now is wait and pray
religion,there is no more pending legal actions from no where period
sports,strong atheism is a positive belief that god does not exist
religion,don't get me wrong i'm not blaming the loss on stewart
religion,is anyone lucky enough to have tickets to see this one
religion,00 0 2 0 caufield pit 26 0 0 0 0
religion,63 44 33 11 drake det 71 18 26 44 0
religion,48 38 67 8 momesso van 82 18 20 38 0
religion,25 9 61 -1 petrovicky har 42 3 6 9 0
religion,he went with the backhander but soderstrom was all over it
sports,5 7-3 won 1 06-01 02-04 toronto blue jays 07 06
religion,this seems to be attested by the elamite tablets at persepolis
religion,14 8 82 -14 anderson was 57 2 6 8 0
sports,for what is a knowledgeable believer except a contradiction of terms
sports,5 4-6 won 1 04-03 04-04 los angeles dodgers 06 08
sports,ryan pontificated is this from the quran or however it's spelled
religion,i don't think that homosexuals should be hung by their toenails
religion,see gould's male nipples and clitoral ripples in bully for brontosaurus
religion,if the children are not being fed whose fault is that
religion,right now there is a sixth grader who is a junkie
sports,but does sheffield have an injury or anythingelse wrong with him
religion,24 19 146 16 neely bos 12 11 7 18 1
religion,29 16 81 -25 glynn edm 62 4 12 16 0
sports,5 2-5 lost 3 02-03 00-02 san diego padres 02 06
religion,this and other experiences such as soul travel replace blind faith
religion,41 23 52 8 mcbain ott 57 7 16 23 0
religion,if contradictions give you meaning then your life must be sad
sports,johnny mize had six three-hr games which is the current record
religion,anaheim and miami will choose no lower than fourth and fifth
religion,31 5 12 -4 bruce sj 17 2 3 5 0
religion,my use of the term always is rather deceptive i admit
sports,but they won't increase prices because it won't work for them
sports,if you must assume something assume something it's easy to test
sports,what law of nature can you invoke to  establish your values
sports,0 3-6 lost 1 03-03 00-03 san diego padres 03 07
religion,29 18 59 -4 mcllwain tor 65 14 4 18 0
religion,of course holik's chop to barrasso's neck wasn't too sportsmanlike either
religion,the flyers set up in the sabres zone and stayed there
religion,90 60 80 -13 keane mon 75 15 45 60 0
religion,21 6 51 2 dinnen ott 31 2 4 6 0
sports,this is the most unmitigated bilge i've seen in a while
religion,the panther is an endangered species mostly located in the everglades
religion,14 10 66 -2 gordijuk buf 16 3 6 9 0
religion,is more directly referenced by james  than job or ruth is
sports,2 21 8 46 1 0 0 0 0 rijo 3
religion,the practice was widespread however among the peoples of central asia
religion,02 1 16 0 moog bos 54 0 1 1 0
sports,reggie sanders then plated sabo with a long fly to center
religion,jesus loved everyone but he called sin by its right name
religion,has this ever this is the only time i know of
religion,67 40 20 -3 ellett tor 68 6 34 40 0
sports,0 4-6 lost 1 03-03 03-05 san diego padres 05 08
religion,some think  it refers to lust others pride but who knows
religion,tor - tor in 7 two totally different teams who knows
sports,before i met this guy i thought all gays were 'faries'
religion,which is why he denies the authenticity of the old testament
sports,maybe no stat can tell me either but some people are
sports,therefore  jesus belongs to the set of things which are eternal
religion,it was very refreshing to see the blues double-dip the hawks
sports,the problem is we don't know what they did before that
religion,his customers would all be people who enjoyed the passive role
sports,to give you the benefit of the doubt prove your statement
religion,14 7 204 -9 vukota nyi 71 2 5 7 0
religion,at least i'm getting to watch the playoffs for a change
sports,note that an objective system is not necessarily an inherent one
religion,can you make a case for tyre having been singled out
sports,revised edition due some time in the next year or two
religion,jesus pointed out that he was the physician for the sinners
religion,marouelli began calling penalties on the blackhawks to even things up
sports,0 8-2 won 2 07-01 02-04 new york yankees 08 07
religion,and would make him a lot of friends in southern ontario
religion,56 38 106 -10 krupp nyi 79 9 29 38 0
sports,but again if it makes organizational sense then so be it
religion,or what the bible teaches according to robert weiss and co
religion,00 0 2 0 chapdelaine la 13 0 0 0 0
sports,- bit deleted righto dan try this one with your cornflakes
religion,23 13 101 -18 rychel la 68 6 7 13 0
religion,it's amazing what those black and gold colored glasses will do
religion,his father tells him that he is on the wrong track
religion,07 5 211 -3 mckim bos 7 1 3 4 0
religion,28 18 57 24 ramage mon 74 5 13 18 0
religion,10 56 14 33 tucker tb 76 17 39 56 0
sports,at least it's better than fielding percentage carney lansford has a
religion,possibly in the ihl but you'd best ask a blues fan
sports,someone else concluded that i did that because i hate him
religion,24 14 48 -6 barr nj 60 6 8 14 0
religion,did not satan cause adam and eve to die as well
religion,so it becomes a matter not of intelligence but of pride
religion,38 26 62 -40 osborne tor 75 12 14 26 0
religion,but what of the wicked who have died over the millennia
religion,if the team can rally around him maybe moog can too
sports,another characteristic of lenin-stalin socialism was the centralization of food distribution
religion,08 5 2 0 ray buf 68 3 2 5 0
religion,this aerosol is deliberately made to be as non-flammable as possible
sports,assuming he actually cares at all whether people believe in him
sports,kierkegaard once said that god does not exist he is eternal
religion,38 30 57 16 mactavish edm 80 10 20 30 0
religion,then gartner got a penalty and the swedes a power play
religion,every time christ comes into someones heart christ has come again
sports,you have said something about choices and the scenario gives them
religion,my sister is an actress in new york and a christian
sports,is there an atlanta fan or anyone reading this who knows
religion,24 6 30 6 carney buf 29 2 4 6 0
religion,over the book which crowley was actively promulgating through the order
sports,also feel free to add comments suggestions questions or further explanations
sports,the usual products of such a reaction are energy  different chemicals
religion,first penalty shots are the most exciting thing in hockey right
religion,i don't really understand what you mean by a just war
sports,a coup by americans led to a request to annex it
religion,67 6 4 -5 propp min 15 3 3 6 0
sports,i'm not sure that in the balance it is not detrimental
sports,dolphins have sometimes saved humans from drowning a good deed indeed
sports,here i'll start how about the baltimore baseblazers san francisco quakes
sports,who knows perhaps here we have a way to discriminate morals
religion,19 5 41 3 richter nyr 35 0 5 5 0
religion,00 0 0 0 langway was 21 0 0 0 0
religion,do you degrade them to a sex object in your head
sports,one could make the same sort of argument in other cases
religion,is there anyone out there would thinks that phrasing sounds worse
religion,i will be his father and he shall be my son
religion,and who put the food in the dirt for the roots
sports,519 1991 cws 71 16 3 0 3 12 0 1
sports,player b grounder to short; reaches on the force at 2nd
religion,25 7 35 -3 mallette nj 34 4 3 7 0
religion,54 34 63 16 hull ott 67 13 21 34 0
sports,weak  atheism is simple scepticism; disbelief in the existence of god
religion,louis/minnesota chicago in 6 against the blues 7 against the stars
religion,it doesn't look like this trend will change with the bruins
religion,75 3 4 2 felsner stl 4 0 3 3 0
sports,in his pbs documentary after the war is my main source
religion,i hope that this will encourage her to keep on trying
religion,i don't really know the difference between the various protestant denominations
sports,they might have been writing it as series of fiction short-stories
religion,00 0 2 0 hebert stl 23 0 0 0 0
religion,67 31 4 1 mironov tor 57 7 24 31 0
religion,66 54 134 14 yake har 63 22 31 53 0
religion,09 2 18 -3 woolley was 23 0 2 2 0
sports,0 4-6 won 3 03-03 03-04 san diego padres 05 07
religion,i'm really pissed that the linesmen didn't correct the call either
religion,32 21 70 -9 hamrlik tb 65 6 15 21 0
religion,16  now do you think that ruuttu is only worth 16
religion,i'm sure you've heard of the j and the e texts
religion,39 11 8 -1 konowalchuk was 36 4 7 11 0
sports,uk this article attempts to provide a general introduction to atheism
sports,so he read what he could find in hebrew greek aramaic
religion,grabbing an opponent's stick as a defensive move is a penalty
religion,he is love who is the almighty and the infinite force
sports,i believe that god is the source and ground of being
sports,in response to your last statement no and neither do you
religion,05 82 40 38 granato la 79 37 45 82 1
sports,sheffield comment though the season is early and stats mean nothing
religion,un-altered reproduction and dissemination of this important partial summary is encouraged
religion,20 god would have had to have written in large letters
religion,23 14 44 3 taglianetti pit 71 2 12 14 0
religion,there is a lot more but i got tired of writing
religion,this is virtually all over the place especially in this country
religion,31 10 63 -5 featherstone bos 34 5 5 10 0
religion,81 50 90 2 norton nyi 63 12 38 50 0
religion,what about the person who wants to sleep with his aunts
religion,47 20 31 -14 lomakin phi 48 8 12 20 0
religion,22 17 56 4 erickson win 39 4 12 16 0
religion,09 2 6 0 watters la 22 0 2 2 0
religion,as i've said the law was fulfilled not done away with
religion,i feel compelled to commit myself to gay causes he says
religion,the one dimension that we can measure is the clock time
sports,any fool could tell them lavalliere wasn't very fit last year
religion,let's hope that we start getting some luck for a change
sports,the new york talk shows are just awful in this regard
religion,03 1 4 0 fitzpatrick nyi 37 0 1 1 0
sports,baseball harry talks about this incident in his autobiography holy cow
religion,38 29 247 37 sydor la 78 6 23 29 0
sports,regarding the verses relevant to nature i prefer to use dr
sports,750 -- 6-2 lost 1 04-02 02-00 california angels 05 02
religion,if so post away or you could mail it to me
religion,but how can one deny that it does in fact exist
religion,kt kt he taught the prisoners and freed them from darkness
sports,5 4-3 won 1 03-02 01-01 chicago white sox 04 04
religion,edgar hoover was very impressed with the way they kept secrets
religion,65 132 26 -2 selanne win 82 76 56 132 1
religion,but suppose christ did rise from the dead what of it
religion,jesus' comments about how christians have to follow the ot deleted
religion,09 2 43 -2 blue bos 22 0 2 2 0
religion,36 27 20 -1 kypreos har 75 17 10 27 0
sports,scouting since i always understood scouting to teach tolerance and diversity
sports,do we try to explain the output from a broken computer
religion,30 16 122 6 carter sj 55 7 9 16 0
religion,just as the moslems aren't religious and the buddhists aren't religious
religion,lemieux 68 - stevens tocchet 142 njd semak 36 - c
religion,he would also be hardpressed to make the team next year
religion,all these costs are covered during that time and then some
religion,33 20 109 6 maltais tb 61 7 13 20 0
religion,your body feels pain to let you know something is wrong
religion,the difference is that cherry knows the game and fischler doesn't
sports,the 15 inning game had the same effect the next night
sports,we also might differ upon what it means to have faith
sports,in its original form it said do not multiply entities unnecessarily
religion,14 8 96 -48 hammond ott 61 4 4 8 0
religion,13 3 8 -2 hrivnak win 29 0 3 3 0
religion,from all such bad news you have delivered us good god
religion,second period 1 san jose garpenlov 22 odgers gaudreau pp 337
religion,finally he came to his senses and thought maria was dead
sports,this is important since he struggles so much with breaking balls
religion,i work at an agency that investigates child abuse and neglect
religion,13 54 59 15 sutter chi 63 20 34 54 0
sports,isn't that what you're doing when assuming an objectively real morality
sports,oakland california sunday april 25th 105 pm pdt jose mesa vs
religion,29 2 0 -6 kolstad sj 10 0 2 2 0
sports,he comes across the bag improperly and his release is slow
sports,whatever doesn't look like he stuck around the majors too long
religion,36 22 30 0 mckay nj 71 11 11 22 0
sports,as for the second it is the foundation of the religion
religion,as a christian i am free to be a human person
religion,are a few more types of anti-matter atoms worth the $8
sports,let them be blotted out of the book of the living
religion,spiritual gifts are no different -- you get better with experience
religion,no i was happy to accept the church as god's revelation
religion,at which time you are truly not the master of yourself
sports,a most of the people i debate disagree with my premises
sports,suppose the united states were the only nuclear power on earth
religion,josh perhaps you can quote just a bit of her argument
religion,purpose is to encourage each other so we will remain faithful
religion,14 11 73 -15 lazaro ott 26 6 4 10 0
religion,edu   isu only censors what i read not what i say
religion,23 102 33 21 hull stl 78 54 47 101 1
sports,the pi quoted bosio that this was a batting practice fastball
religion,the answer lies in the location of paradise when jesus died
religion,61 49 96 0 poulin bos 83 16 33 49 0
sports,this is a thing that is commonly referred to as nihilism
sports,well if atheism's so great why are there so many theists
sports,i'm still catching up from spring break but bear with me
sports,5 5-2 won 3 03-02 02-00 chicago white sox 04 04
religion,19 13 221 7 stapleton pit 78 4 9 13 0
religion,first your reading of the virgin birth is an uncommon one
sports,600 -- 6-4 won 1 03-01 03-03 houston astros 05 04
religion,by the way don't get me wrong -- i like jagr
religion,45 5 2 -3 lipuma tb 13 0 5 5 0
sports,and exactly why should the quotation marks enclose laws not must
