religion,this has to do with maintaining a proper witness toward others
religion,wbt literature is concerned mainly with providing scripture  in minority languages
religion,vancouver-winnipeg is great west-coast hockey - fast-paced and loads of talent
religion,00 17 18 -4 dipietro mon 27 4 13 17 0
religion,we got nesn's coverage of the bruins-sabres with the boston homers
religion,how jewish was paul after he changed his name from saul
religion,edu ra ra  well jason it's heretical in a few ways
religion,51 67 6 6 zalapski har 80 14 51 65 0
sports,now of course you don't have to read any of this
religion,25 15 71 21 konroyd det 65 3 12 15 0
religion,but to those who stand on this base he is precious
religion,people will understand it in a distorted way with inevitable consequences
religion,what he said sounded like a load of crap to me
sports,how do you choose what to believe and what not to
sports,i always preceeded my statements with it is my understanding that
religion,the scriptures involved are mat 2223-30 mark 1218-25 and luke 2027-36
religion,your name isn't attached to it so why moan and complain
religion,80 65 148 -4 anderson tor 74 21 43 64 0
sports,i don't think valentine ever said boston will win this year
sports,i wrote elsewhere that morality should be hypotheses about observed value
religion,17 9 83 4 maley sj 55 2 7 9 0
sports,the lurid overstatements were obviously intended to humiliate the original poster
sports,enforcing a judgment is distinct from the making of a judgment
religion,32 24 67 -2 shaw bos 76 10 14 24 0
religion,biggest disappointment = the player from whom we expected more e
religion,11 2 38 0 carlyle win 22 1 1 2 0
religion,julie it is a really trying situation that you have described
sports,simpler to make the diseases less lethal if he wants survivors
religion,1 timothy 41-5 salvation is free but you must receive it
sports,you will all go to hell for not believing in god
religion,56 45 98 19 schneider mon 58 13 31 44 0
religion,but god offers us the opportunity to be more than conquerers
sports,it also said something about being a polite alternative to may
religion,03 1 106 3 puppa tor 32 0 1 1 0
sports,and there are women on the field to lead the crowd
religion,if they make it again they will probably keep the cup
religion,finally don and ron discussed keenan becoming coach of the rangers
sports,but some- body has to win so i pick the orioles
religion,they would supply a dozen or so players including 2 goalies
sports,if they don't make the post-season they don't win the series
religion,tract printed by and available free of charge from family radio
religion,00 0 0 0 chabot mon 1 0 0 0 0
sports,i wuold think that lasdtexas and fla are on in spanish
religion,00 0 0 0 hirsch nyr 4 0 0 0 0
religion,in nyc i can recommend corpus christi - w 12st st
religion,the rest were either very green rookies or washed up veterans
sports,they have sex all the time homosexual as well as heterosexual
religion,playoffs will begin on 4/18 and end on or before 6/14
religion,now a is going to be funded but some people object
sports,i know rickey henderson doesn't have a career out of baseball
religion,but still why would i want to rise from the dead
religion,37 29 59 0 duchesne min 82 16 13 29 0
religion,q how many professional hockey leagues are there in north america
religion,04 1 6 0 ciccone min 29 0 1 1 0
sports,pretty clearly alomar got a huge boost from his home park
religion,hey patrick the montana magic played in billings not great falls
sports,447 1991 atl 110 20 2 1 4 12 10 3
sports,internationaler bund der konfessionslosen und atheisten postfach 880 d-1000 berlin 41
sports,in fact i was trying to encourage others to use it
religion,so far about 20-30 people have been seen outside the compound
religion,44 24 57 -25 freer ott 61 10 14 24 0
sports,395 1992 atl 306 92 10 12 11 22 24 9
sports,311 1992 grn 445 135 22 2 14 22 7 2
religion,jesus told us to be aware of imposters 2000 years ago
religion,63 43 64 4 turgeon ott 70 25 18 43 0
religion,he worked hard and at least didn't make any rookie mistakes
religion,is it consistent with the history and geography of the time
religion,29 19 176 -26 kucera chi 70 5 14 19 0
religion,flyers up to 71 points on the season in 78 games
religion,terry carkner then took a kneeing penalty at 751 on gilmour
religion,36 94 168 9 muller mon 79 37 57 94 1
religion,51 40 47 8 racine det 79 9 31 40 0
sports,i wish i hadn't sold my copy of jewish baseball stars
religion,if you will mailmen could be called apostles in that sense
religion,sanderson-dineen-brind'amour worked hard and kept the puck in the swedes' zone
sports,this one and bush's invasion were the two i mentioned above
religion,butler did give at least  one source you have given none
religion,bundy walter bush murray costello jim gregory leslie kaplan lawrence g
religion,buffalo seems to have started a tradition of trading its captains
religion,this is why married women usually didn't work until recent decades
sports,this view is supported by computer simulations of evolution eg tierra
religion,what are the two tails that hang down the back represent
religion,52 33 78 -6 wesley bos 64 8 25 33 0
religion,he can't stay on his skates with most forwards or centers
religion,65 48 52 -21 rucinsky que 76 18 30 48 0
religion,but in the playoffs talent matters because everyone begins working hard
sports,until then i think this was a case of selective enforcement
sports,300 in atlanta and continued to walk alot after his promotion
religion,which can be an order of magnitude more expensive than abortion
sports,the media would have you beleive he was a great hitter
religion,second i do not accept the assumptions that you make here
religion,04 3 28 0 rivers tb 4 0 2 2 0
sports,i have lived in the boston area for 15 years now
religion,i thought you were talking about times that tyre was destroyed
religion,now don't read all your objections of me into that statement
religion,33 20 35 -19 burt har 62 6 14 20 0
sports,so only gross was fresh given his light work out tuesday
sports,200 1989 eas 123 35 1 2 2 9 15 4
religion,whatever a man sows - that shall he reap galatians 67
sports,when the if rule is invoked the batter is automatically out
religion,my condolences to the minnesota fans who are losing their team
religion,04 83 165 3 verbeek har 81 39 43 82 1
sports,a sound argument is a valid argument whose premises are true
sports,indeed jesus doesn't do much groaning even when on the cross
religion,remember 3pts for 1st 2 for 2nd and 1 for 3rd
religion,01 82 38 4 duchesne que 81 20 62 82 1
sports,range is not the only thing that makes a good firstbaseman
religion,16 9 143 -27 daniels pit 57 5 4 9 0
religion,i never said that the law was made obsolete by jesus
sports,i suggested we go talk to the priest and she agreed
sports,ask ken kaiser if he got his money back from nutri-system
religion,i don't feel like i have to defend this team anymore
sports,and of the 7% that was the smart stuff 35% hit
religion,you are merely expressing approval of the consequences i find therein
sports,in fact that's exactly the point people can control their behavior
religion,17 13 10 -8 richardson edm 80 3 10 13 0
sports,the equations used are found at the end of the post
sports,there is no method inherent in baseball of comparing individual performances
religion,27 20 60 11 marchment chi 76 5 15 20 0
religion,even a personal certainty leaves room for the beliefs of others
sports,6 i do not believe that there is not a god
sports,assuming of course that he starts hitting one of these days
religion,note that i am not denying that gay christians are  christian
religion,rychel was checked off the puck at the flames blue line
sports,the weakness of your arguments are for all netters to see
religion,the blues ranked among the best special teams in the league
religion,18-9 surely this sets the standard and not just man-made traditions
religion,and still some of them chose to disobey and were destroyed
religion,very useful in helping me understand some of the rc beliefs
religion,02 1 20 0 baumgartner tor 61 1 0 1 0
sports,young 2b 28 9 1 1 1 5 10 5 3
sports,i might just as well divide the world into subjectobject event
religion,let the saints rejoice in his honour and sing for joy
sports,the words have pierced really do not exist in the psalm
religion,39 79 172 31 semak nj 80 37 42 79 0
religion,at the moment he stops speaking and people start interpreting the
religion,a christian woman hires a carpenter to build her a birdhouse
religion,i was using why as why did this come to be
sports,wouldn't people be able to tell if he was a liar
sports,but i thought we were discussing the need to shorten games
sports,matthew only devotes five verses to the visit with the disciples
religion,deciding what was truely a fulfillment of prophesy is very tricky
religion,far be it from you lord to do such a thing
religion,they didn't catch you doing anything wrong like they caught me
religion,an analogy someone used a while back can perhaps illustrate it
religion,why was a pipe deliveryu system used rather than remote launchers
religion,the weakness is an obvious corollary this is not usually possible
religion,the law has been fulfilled as christ said he would do
religion,it is an easy and as straight forward as it reads
religion,27 17 55 7 roberts bos 64 5 12 17 0
sports,this is something that can be checked by anyone sufficiently interested
religion,i prefer to go to mass at the next parish over
sports,roger apparently is one of those embarassing specimens who enjoys flames
religion,36 27 325 -5 andersson tb 75 16 11 27 0
religion,he gave the impression that he was willing to do so
religion,as an atheist i am free to be a human person
religion,00 0 60 -1 hasek buf 27 0 0 0 0
sports,800 -- 8-2 lost 1 05-01 03-01 pittsburgh pirates 07 03
religion,87 74 30 2 zhamnov win 66 25 47 72 1
religion,every year brother roger writes an open letter to the young
sports,the punishments vary according to the situation the apostate is in
religion,damasus i pope the decree of damsus section 2 382 ad
religion,15 11 100 -6 ludwig min 76 1 10 11 0
religion,really have you no better response to `slander' than more slander
religion,as long as we're trading references i'd like to suggest dr
religion,uh oh michael; you typed hell and capitalized it to boot
sports,this is in direct opposition to the parables in the psalms
religion,it just wouldn't work w/o god in the marraige as well
religion,he said someone told him the lord gave me a song
religion,or a wing should hammer the living shit out of him
sports,but given time they will say they are comfortable with lopez
sports,does anybody think vizquel was wrong to field the ball barehanded
sports,i'm afraid i don't know arabic; i have only read translations
sports,the christian bible says that one may kill under certain circumstances
sports,once a criminal has committed a murder his desires are irrelevant
sports,and the three and a half hour golf game with it
sports,should he be banned from baseball for a year like schott
religion,26 7 8 -6 wiemer bos 27 1 6 7 0
religion,flyers owner ed snyder is livid and beside himself over this
religion,56 45 210 -26 desjardins mon 81 13 32 45 0
sports,deletion the reference to it's not yet being ethics is dubious
religion,i wish for him to one day join me in paradise
religion,if my diety exists you would not just cease to exist
religion,lisa's luggers 51 25 197 stanias stars 51 25 161 198
sports,there is also the question of what is meant by atheist
religion,when his brothers nervously apologized he told them do not worry
sports,call me a fool but i believe he did -heal people
sports,but then they lost 2 high picks in the bonds fiasco
religion,so you believe in the existance of one creator i assume
religion,this passage is not a mother image of god at all
religion,that only makes common sense since they didn't lose many games
religion,81 57 40 0 smith chi 76 10 47 57 0
religion,39 9 16 4 boivin phi 30 5 4 9 0
religion,there will be no defense at the judgment seat of god
sports,there is only one way of determin- ing best in baseball
religion,29 75 143 25 hogue nyi 67 33 42 75 1
religion,aside from that second goal roy did stand on his head
religion,designated playmaker = steve smith actual g=1 a=11 pts=12 modified g=10
religion,however it is only possible to exist or not to exist
religion,12 9 145 -25 houlder buf 13 3 5 8 0
sports,if we keep klesko we either lose the money or cabrera
religion,bc the highway was put here for people to be on
religion,rw i don't see the effort to equate salvation with paradise
religion,55 36 10 12 lapointe que 73 10 26 36 0
religion,she don't want to associate anymore with her old christian friends
sports,000 -- 1-0 won 1 00-00 01-00 california angels 00 00
religion,you sound happy enough; that's fairly much all that matters right
religion,it's not to say that we don't stumble now and then
religion,02 1 14 0 beaupre was 57 0 1 1 0
sports,precisely because the team that scores more runs wins the game
religion,there's no objective physics; einstein and bohr have told us that
religion,i turned back to espn around 11 and it was hockey
religion,39 16 29 3 erixon nyr 42 5 11 16 0
religion,02 1 155 -11 bales bos 1 0 0 0 0
sports,from your posts you seem fairly well versed in sunni thought
sports,neither of these teams will threaten to win anything of course
religion,16 8 36 -11 mcintyre nyr 57 3 5 8 0
religion,he should be a solid contender for regular duty next season
sports,national league name hs nhs ndp neb dcon dops alicea l
religion,remoteness from reality of each model and the degree of cooling
sports,by studying fallacies we aim to avoid being misled by them
religion,67 38 28 -6 kovalev nyr 63 20 18 38 0
religion,he is relating the story as i have heard it btw
sports,but i think you're reading a lot into one flip sentence
religion,frank i got your mailing on early historical references to christianity
religion,29 21 286 -8 kasparaitis nyi 77 4 17 21 0
sports,please give him the same coutesy you' trh ve given me
religion,almost one third of the world's population claim to be christian
religion,if somebody has some sort of scoring system let me know
religion,86 57 22 -5 makarov cal 70 18 39 57 0
religion,03 2 76 -5 grimson chi 76 1 1 2 0
sports,i hate to be so sarcastic on such a beautiful day
religion,16 13 128 8 daneyko nj 82 2 11 13 0
religion,hearts are often favored for this as it contains the spirit
sports,have a look at the discussion of the axiom of choice
sports,786 -- 8-2 won 4 06-01 05-02 detroit tigers 08 05
sports,therefore i seriously doubt it could ever come to right conclusions
religion,each testifier tells of his own experiences with the living god
religion,it's amazing how everyone automatically blames one side or the other
religion,that in part betrays the present political correctness of the issue
religion,61 45 54 0 miller was 81 18 27 45 0
sports,amazingly pitchers no matter how good their mechanics are not machines
religion,' here we may have a graphic explanation of judas' death
sports,the original poster wanted to know how the big cat looked
religion,never mind the stoning the being burned alive the possible crucifixion
sports,and for those who consider such things important was a absolute-primo-dick
religion,anyone could unless they remain forever celibate iv-drug-free and transfusion free
religion,sometimes those fundamental principles are crystal clear at least to evangelicals
religion,this seems to be the error of many sola scriptura believers
religion,sending jesus was one of his attempts to reconcile with mankind
religion,02 1 18 0 mclean van 54 0 1 1 0
religion,it has to be something related to our current post-modernism state
religion,behold i christ come quickly; and my reward is with me
religion,63 48 51 14 weight edm 76 17 31 48 0
religion,at no time have i ever even heard this hinted at
religion,-john 1623-24 i don't believe that we necessarily have to say
religion,isn't it an unatural use of what god has given us
religion,original sin is the reason we need faith to be saved
religion,second jesus is in some sense doubly indirect from the father
sports,so are you saying that they redesign the plates each year
sports,atheism can only exist when people reject all the idols/gods/dogmas/ suppositions/
sports,face it there are better things to do with your life
sports,363 obp even though he's never had a batting average over
religion,kevin todd is an oiler and has been one for months
religion,14 5 2 0 bawa sj 41 5 0 5 0
religion,37 14 65 4 pantaleyev bos 39 8 6 14 0
religion,the puck went straight off fuhr's leg and into the net
religion,today's scholars are just a bit more slick in their approach
religion,god then cannot ask for anything but punishement for those sins
religion,39 24 39 -32 cavallini que 66 9 15 24 0
religion,things that exist do and things that don't exist don't exist
sports,769 -- 7-3 won 3 06-01 04-02 detroit tigers 07 05
religion,humans are in a state of tension a tension of opposites
sports,is it just me or has this part gotten beyond useful
sports,people there is no historical proof of this see earlier threads
sports,why don't we look at this one again in say july
religion,33 3 10 2 black min 10 2 1 3 0
religion,24 13 24 -2 lowry stl 56 5 8 13 0
religion,it was later learned that he was sharpening a 91/2 blade
religion,he shall crush your head and you shall bruise his heel
sports,another example god created you; therefore do your duty to god
religion,we had a discussion about the difference between christianity and islam
religion,everyone i know who has a father usually as a mother
religion,the point is not that there's anything intrinsically wrong with it
sports,secondly i am very much for the control of population growth
religion,32 26 131 -1 brunet mon 45 10 15 25 0
religion,well one day the order came from rome for his retirement
religion,devorski unfortunately helped to taint an otherwise brilliant display by maclean
religion,well it's that time of year again here at iu graduation
religion,the lds church does own a heck of a lot however
sports,some other frequently asked questions are answered in a companion article
religion,29 23 105 9 acton phi 80 8 15 23 0
religion,you should also read the book becoming orthodox by peter gillquist
religion,basicallythe bruins will be on the golf course by next weekend
religion,god's will can never be accomplished through the disbelief of man
sports,louis gave up for him but it was not too much
religion,21 7 56 3 hynes phi 36 3 4 7 0
religion,00 1 0 1 sullivan nj 2 0 1 1 0
sports,the braves will finish ahead of the rockies in the standings
religion,if you mean amorc you didn't even learn the correct name
sports,in the end the individual is responsible for his/her own irrationality
religion,as for cruel killing a living being solely because it exsist
religion,minor major bench misc misc misc match pim wichita 1876 31
religion,we shouldn't make a new denomination to try to solve problems
religion,of course that excepts that weird russian / romanian 18th cent
religion,which they are finding in existing colliders fermi lab cern etc
sports,688 -- 7-3 lost 2 06-01 05-04 detroit tigers 09 05
religion,the plane crashed 200 metres within south africa's boundary with mozambique
religion,00 0 0 0 semchuk la 1 0 0 0 0
religion,american for you are in dire need of some cultural enlightenment
sports,i heard bing speak about it at last year's sabr national
religion,today we have a poor poor concept of sin & god
religion,be named after them instead of morenz vezina howe orr etc
religion,these are all things that have a direct application to usenet
religion,depending on how they use this knowledge they can be scary
religion,09 6 151 5 lang la 11 0 5 5 0
religion,it simply acknowledged that fact that it didn't apply to gentiles
sports,surely you don't think all this appeared here just by chance
religion,26 16 58 -12 boschman ott 68 9 7 16 0
religion,putting hrudey on the bench for a month is just stupid
religion,flashbacks of wwii as well as vietnam should be haunting us
sports,the major problem with this analysis is that it ignores age
sports,as i don't know this book i will use your heresay
sports,i am not aware of any turkish caliphate viewpoint on this
sports,although i suspect an argument might have gotten gant tossed altogether
religion,23 15 67 -15 zombo stl 69 0 15 15 0
religion,john mark bishop of alexandria was translator for and his predecessors
religion,38 5 32 1 brown nj 15 0 5 5 0
religion,however he was the culmination of the promises of the prophets
religion,01 82 180 -11 ridley was 81 26 56 82 1
religion,it has remained a member of that council since 1948 a
religion,he responded by swearing and declaring that he was an atheist
sports,omniscience is fine as long as information is not given away
sports,0 5-5 lost 1 04-04 03-03 new york mets 07 07
religion,i would appreciate it if you would not refer to mr
religion,radical conservatives are possible if sadly lacking in numbers at present
sports,after a quick start pena has been stuck in a rut
religion,43 35 61 2 benning edm 55 10 24 34 0
religion,if his love were conditional i not know him at all
religion,heaven is one of two final states that christian doctrine postulates
sports,the concept of strong atheism is not just a whimsical fantasy
religion,41 33 22 7 leeman mon 50 15 17 32 0
religion,38 10 16 -8 norwood stl 32 3 7 10 0
religion,i am not 100% sure about the deal with the sharks
religion,48 32 147 -4 primeau det 73 15 17 32 0
religion,then he goes on the make statements which make me shudder
religion,and i'm certainly under no obligation to reply to them all
religion,that's an entirely different purpose than sending the letter to bettman
sports,qur'an 33 the positive aspect of this verse noted by dr
religion,god reveals his will to both the husband and the wife
religion,74 56 69 -10 macinnis cal 48 11 43 54 1
religion,i don't see nothing fundamentally wrong with us containing something divine
religion,94 77 167 23 nolan que 72 36 40 76 1
religion,98 40 42 15 chambers tb 53 10 29 39 0
sports,btw i don't think thomas was hurt by those three months
religion,mcconkie attacked christians for saying jehovah can refer to the father
sports,does he foul off a lot of pitches like brett butler
religion,word is that the ones he let go were not his
religion,33 16 60 -14 ledyard buf 48 2 14 16 0
religion,i agree which is why i've asked for help with it
sports,very true length of time for discussions on creationism vs evolutionism
religion,he was also one of the early workers on the dss
religion,54 43 292 -9 wood buf 80 18 25 43 0
religion,50 11 8 10 vujtek edm 28 1 10 11 0
religion,odds are the gospel of john was written around 90 a
sports,using the 1992 defensive averages posted by sherri nichols thanks sherri
religion,there is some risk that i may not believe it otherwise
religion,a similar situation arises with the establishment of the jewish state
sports,everyone was told of the new emphasis on speeding up games
sports,all in all these two games show a different phillies team
sports,in the postseason he sucked dirty canal water through a straw
religion,as long as i live i am yours utterly and completely
religion,i think that the problem here is one of word usage
religion,louis because otherwise there would probably be a game 6 scheduled
sports,your god is just one aspect of his and her presence
religion,if my only motivation is fear is there room for trust
sports,no need to correct it it stands as it is said
religion,62 44 91 14 lumme van 73 8 36 44 0
religion,you hadn't made that clear; i'm glad to have it clarified
religion,that particular faq i've forgotten the author discusses the traditional vs
religion,the pens without mario are still a damn good hockey team
sports,5 5-5 lost 1 04-02 03-04 new york yankees 06 07
religion,the paragraph at the end is from the book not me
religion,14 87 109 0 coffey det 79 12 75 87 1
religion,i've seen documentation which links them through the figure of h
religion,94 66 29 7 garpenlov sj 78 22 44 66 0
religion,37 30 133 -24 janssens har 73 12 17 29 0
religion,59 40 46 17 tikkanen nyr 78 16 24 40 0
religion,the word agros is defined as a field in the country
religion,31 23 60 -14 johnson min 79 3 20 23 0
religion,even the jews could not decide where the boundaries fall though
religion,when the pirates play the games will be carried by wdve102
sports,none were horrible but four were five or more games below
religion,god has promised to give you light so ask for it
religion,meaning the grave or pit compare acts 227 with psalms 1610
religion,31 22 199 1 konstantinov det 81 5 17 22 0
religion,i take several people who can speak only one language e
sports,889 -- 8-1 won 5 05-01 03-00 pittsburgh pirates 06 02
religion,74 57 66 2 stevens nj 79 12 45 57 0
sports,your wish to slur all theists seems pretty fanatical to me
sports,that seriously underrepresents the harm he has done in the field
religion,faith are out of luck -- and this is the result
sports,the reference to the piercing looks a lot like jesus's crucifixion
sports,he's a much better hitter although hernandez isn't a bad hitter
sports,if not fine; your filling out the survey alone is great
sports,- anyway was i dreaming or is there some such animal
religion,60 39 187 3 khmylev buf 66 20 19 39 0
religion,29 10 102 6 murphy ott 42 3 7 10 0
sports,your argument is of the type you'll know once you try
