sports,perhaps big j was just mistaken about some of his claims
sports,all who refuse to worhsip sic the image will be killed
religion,78 62 98 14 mceachern pit 83 28 33 61 0
religion,so the plan was to pour the gas into the compound
sports,as far as i can tell all the categories are full
religion,45 19 51 -5 chorske nj 50 7 12 19 0
religion,misc  readers read some wittgenstein 60% of the postings would disappear
religion,now if there is no hell then jesus preached in vain
religion,as a catholic i was told that a jew buddhist etc
sports,clearly neither of these guys is bright enough to be moe
religion,rolandbehunin 5 cal-6 que-7 que-7 davewessels 5 van-7 pit-6 pit-5 3
religion,by 1970 he would move to being the congregation's lead minister
sports,i'm sure some of that basis would have utilized prior performance
religion,so not everyone who calls themself a christian is a christian
religion,there are a couple of other passages in acts as well
sports,the conclusion is often stated as the final stage of inference
religion,certainly they can as the example of john in utero proves
religion,05 3 30 -25 casey min 58 0 3 3 0
religion,they are just collecting the votes as a neutral third party
religion,54 31 38 -2 bureau tb 63 10 21 31 0
sports,the bowler is john burkett who went to 4-0 last night
sports,it is easy to enjoy them but they cause great anxiety
religion,the priest knew about the dogma being four years old then
sports,however i am afraid of andres actually doing well this season
religion,13 89 28 -24 reichel cal 78 40 48 88 1
sports,the garbage started hitting the field well before the sunday game
sports,the bible itself is not the point it's what it contains
religion,thus the same word can be used to convey different meanings
sports,302 hayes 3b 46 13 2 3 11 7 2 3
religion,he reasoned that she was not of /much profit to society
sports,the frightening thought is there are people even worse than he
religion,the only thing one will gain with that attitude is folly
sports,the flat-earthers state that the earth is flat is a fact
sports,propositions or statements are the building blocks of a logical argument
religion,26 8 37 4 loiselle nyi 38 5 3 8 0
religion,62 48 100 -7 corson edm 78 16 31 47 0
sports,yes i also wonder if they can win with this manager
religion,these organizations are for people who are spiritually and emotionally wounded
sports,6 run lower era would have saved the bullpen even more
religion,we're professional wni outlaws - we do this for a living
religion,44 32 152 -6 gilbert chi 75 13 19 32 0
religion,this will continue while we disobey god or sin against him
religion,``once we got up 4-0 it was really tough to play
religion,00 0 0 0 burridge was 1 0 0 0 0
religion,i do hate liars or the six letter variety of same
religion,30 18 12 6 errey buf 61 9 9 18 0
sports,the saturday game ended at 545pm and it was cold then
religion,but not to take any of the credit away from gilmour
religion,- jack  please tell me if you don't get this message
religion,didn't they strip wendel clark of his capta incy in toronto
religion,note that the passage isn't about homosexuality -- it's about idolatry
sports,this is the crux of the argument to me at least
religion,if the batf had stayed home all would be alive now
religion,note that i am not denying that gay christians are christian
sports,did lasorda say before the game here's the lineup i'm using
religion,recall that jesus' words do not stand alone on this subject
religion,so are you saying roger has ever had a valid point
sports,0 3-7 lost 1 02-04 02-04 american west won lost pct
religion,sinning in the face of god was punishable by immediate death
religion,he wanted him to become a famous brave and honoured soldier
religion,-why does he pray to the father and not to himself
sports,i can put the same question to followers of any religion
religion,03 1 8 0 potvin tor 46 0 1 1 0
religion,43 33 96 6 broten min 80 12 21 33 0
sports,i agree that we should move the discussion to another newsgroup
religion,but at this very moment brian hasn't gotten even that far
religion,there was no time for a prior cause to occur in
religion,there is however no penetration of one nature into the other
religion,are you going to accuse them all of being mere jokers
religion,he gives a fictional treatment in his book the great divorce
religion,33 6 4 1 kerr har 22 0 6 6 0
sports,0 3-6 won 2 02-04 01-02 american west won lost pct
sports,only thru faith can we understand the higher logic in god
sports,he has at least three games with three and maybe 4
religion,i've been here in illinois usa i have not encountered it
religion,33 1 0 0 beaufait sj 4 1 0 1 0
religion,08 4 40 -2 baron stl 53 2 2 4 0
sports,0 6-4 won 1 04-03 03-02 chicago white sox 06 07
sports,unless there is reason to expect consistency a run proves nothing
religion,13 2 67 -2 bennett chi 16 0 2 2 0
sports,good hands are needed for such plays and thus have value
religion,well i guess there goes the nhl ratings for sundays game
sports,2 144 64 166 20 26 8 3 1 smoltz 3
religion,anything i do that is not from love is a sin
religion,68 41 56 -4 kudelski ott 61 24 17 41 0
sports,1 175 56 133 12 26 5 1 5 mussina 2
sports,no one says you have to read any of it ralph
sports,i did not claim to be able to predict the future
sports,maldanado has pitched three scoreless innings and navarro's era is 0
sports,all other things being equal if frank viola with his 3
religion,2 dreams and oobes have a reality of their own i
religion,24 18 64 15 murphy chi 17 7 10 17 1
sports,you just have to be careful about what conclusions you draw
religion,96 73 44 0 emerson stl 80 22 51 73 0
religion,57 37 33 4 pearson tor 76 23 14 37 0
religion,love is not a passive feeling it must be actively willed
sports,615 -- 7-3 won 1 05-02 03-03 houston astros 07 05
sports,no wonder that we don't see any detail for this claim
sports,so i'd say to all extents and purposes yes you might
religion,they said they will show whatever game means the most playoff-wise
religion,i don't have a problem with being condemned to hell either
religion,he told his people not to have any elohim but him
sports,science does have a built-in defence against faith and dogma skepticism
sports,project scoresheet and later stats were founded to fill this void
religion,is anyone aware of any books that deal with this subject
sports,2 167 46 119 15 29 3 1 2 benes 3
religion,if god determines a standard of conduct that standard is objective
religion,because brian you enjoy not having a clue about the bible
sports,soon we're going to have to give you a new nickname
religion,if the lord has given you something to say say it
religion,i never said that the law was made  obsolete by jesus
religion,the flyers had a little trouble getting started but eventually did
sports,in order to try and cut down on this the alt
sports,gb last 10 streak home road oakland athletics 01 00 1
religion,philo josephu plutarch and others used these words or related concepts
religion,if 'easter' and 'ishtar' were related their history would show it
religion,but i get the gist and i have to tentatively agree
sports,deion was getting pelted with trash the whole time it seemed
religion,39 12 46 -6 petit cal 34 3 9 12 0
religion,please show me a species poofed into existence by your god
sports,the big red machine of the 70's was league-average in pitching
religion,all i ask for is proof of the assertion god exists
sports,the us has never invaded nicaragua as far as i know
religion,39 14 20 1 skrudland cal 38 7 7 14 0
religion,it is impossible to exactly date the scriptures even the n
religion,it is as bizarre to you as it is to me
religion,he told another not to say good bye to his family
religion,19 6 30 -19 albelin nj 34 1 5 6 0
religion,05 1 0 0 potvin la 19 0 1 1 0
religion,i bind unto myself today  vera noyes i am your religion
religion,truth is reason; truth eternal tells me i've a mother there
religion,some of the f's have come out as t's and visa-versa
religion,many people claim that there are no absolutes in the world
religion,nor is an empty tomb necessary for a claim of resurrection
religion,again i'm not trying to be contentions i'm trying to understand
religion,it was taken over by mitch mcgowan for the 1992-93 season
sports,you would expect to see the rest of the staff improve
religion,i'm was just trying to locate the beginning of murray's decisions
sports,2 168 36 64 8 25 4 2 1 clemens 2
religion,17 2 2 0 eakins win 14 0 2 2 0
religion,52 127 100 16 recchi phi 81 53 70 123 1
religion,larson often used the term coordinate time when writing about this
religion,govt as an instrument of control regulation penetration espionage and repression
religion,until then i consider myself married for life in god's eyes
religion,and i can see the sense of fairness for all groups
religion,the elders and ministers were on top like a big pyramid
religion,get off espn's back and stop posting articles on this subject
religion,ranger last see mike went who is the penalties and reason
religion,for many people but not me this is the study bible
sports,you personally have never seen a neutrino before but they exist
sports,ditto just about everyone else who played into their late 30's
religion,it's possible to see eternal destruction as just that -- destruction
religion,35 26 87 -7 may buf 80 13 13 26 0
sports,did dave winfield have anything to do with the jays' victory
sports,4 i am still disappointed that lopez isn't on the team
religion,33 14 32 -6 smail ott 51 4 10 14 0
religion,analogies can only push an argument so far on both sides
religion,35 25 117 8 tippett pit 73 6 19 25 0
religion,i heard the gregorian chant of the passion on good friday
sports,bringing hot dogs to the umps during the seventh inning stretch
religion,good i guess we only have to work on your grammar
religion,hi what presentation package would you recommend for a bible teacher
religion,roy by no means can be singled out for this loss
religion,if you're last statement is some sort of compromise fair enough
sports,dan johnson- you don't know me but take this hand anyway
religion,in this context it is remarkably offensive to say well la-ti-da
religion,were this person truely humble he would take a different approach
sports,nothing about these consistent winners can influence their chances of winning
religion,20 97 81 12 damphousse mon 82 39 58 97 1
religion,27 8 6 -21 hill mon 30 2 6 8 0
religion,20 16 201 35 andersson nyr 29 4 11 15 0
religion,you believe what you believe- i'm asking for a consistency check
sports,1 173 76 124 12 30 2 0 2 dibble 0
sports,glad to have some serious and constructive contributors in this newsgroup
religion,27 19 59 7 wilson stl 76 8 11 19 0
religion,the bible and the information contained therein are outside the wall
religion,well in my opinion the canucks played a really strong game
sports,when you factor in defense otis was more valuable last year
religion,this sounds real nice but struck me as a little odd
sports,i assume that you are talking about the appeals processes etc
sports,can some historian out there explain history's version of the story
sports,at least none that we've been able to come up with
sports,ask bruce froemming if his parents had any children that lived
religion,after tons of mail could we move this discussion to alt
religion,that his existence can be proven by reason is indisputable cf
religion,i just wish to make sure that their arguments are well-founded
sports,islamic charges such as fasad are levelled at people not books
religion,09 5 65 7 essensa win 66 0 5 5 0
sports,it -is certainly not what i see a lot in churches
religion,that is  why her son's arm is so heavy in pain
religion,we may need to discuss the roles of deacons and elders
religion,this is what prompted someone to send the faq to me
sports,perhaps he was normally insightful but had a few off days
religion,it comes from the hebrew gai hinnom meaning valley of hinniom
sports,you simply cannot show up an umpire like ron gant did
religion,third call me a pessimist but you won't stop the flamage
sports,as it is many fields are allowing three minutes between them
religion,and my son loves to run around in their egyptian museum
sports,476 1988 int 20 3 1 0 0 1 1 1
religion,you must add this the rejection of the right to command
religion,i'm here in a small town in southern illinois at school
sports,the orioles' pitching staff again is having a fine exhibition season
religion,80 60 93 28 flatley nyi 77 13 47 60 0
religion,some ministers claim that they are sexless different that humans etc
religion,there is no question at all what the traditional doctrine is
religion,both of this players are currently on the finnish olympic team
sports,he has looked terrible on the bases and in the field
sports,3000 hits mvp at two different positions uh-huh a real stiff
sports,it's a fun way to get paid for watching baseball games
religion,what she meant was that she loved me and forgave me
sports,you need only read any of friendly christian bill conner's posts
religion,00 36 26 2 ciger edm 62 13 23 36 0
religion,then they showed penguine highlight and went back to stupid basketball
sports,science is distinctly limited in where it can ask meaningful questions
religion,03 2 16 0 vernon cal 63 0 2 2 0
sports,someone who thinks reason is crap won't buy it you see
religion,with the goal at 748 two streaks end for the flyers
religion,34 25 56 7 peluso ott 79 15 10 25 0
religion,06 1 2 0 mcgill tor 19 1 0 1 0
religion,61 43 104 -26 probert det 79 14 29 43 0
religion,in the old testament we have both principles and specific rules
sports,it depends on what sense of excuse you have in mind
sports,the life  death and resurection of christ is documented historical fact
religion,did anyone actually see koresh between day 9 and day 11
religion,53 20 10 -15 wilson sj 42 3 17 20 0
religion,36 25 207 2 lidster van 71 6 19 25 0
religion,like the senators are going to get lindros and $15 million
religion,i certainly hope we've gotten beyond the shooting the messenger stage
religion,in fact i remember the latin phrase natalis solis invicti sp
religion,9 percentage of pro hockey fans who have attended college 54
religion,take your model and hold it directly above a fresh cowpie
religion,i believe jesus only originally was in the context of baptism
sports,it's not a very good example to show citizenship without descent
religion,romans 61-14 don't try to bear tomorrow's burdens with today's grace
sports,i believe the charge levelled against rushdie was that of fasad
religion,either that or he's going to be kicking alot of butt
religion,one of these is environmentalism--respect for our surroundings and our world
religion,people in detroit were calling wendel clarke wendy for not fighting
religion,i do not think it means what you think it means
religion,your god doesn't come to you because your god doesn't exist
sports,he's not spectacular but he's neither light-hitting nor a ten-year man
religion,60 44 55 29 gaudreau sj 58 23 20 43 0
sports,humans have only been around for at most about 200000 years
sports,some of these people say i was abducted experimented on etc
religion,another four or five have been deep subs in the nhl
religion,sometimes it gets too cold and too dark to be comfortable
religion,of course in your termonology god could not cease to exist
religion,79 50 45 -6 cullen tor 64 18 32 50 0
religion,no other new testament verse clearly condemns it besides this one
religion,29 2 58 0 otevrel sj 7 0 2 2 0
religion,one must have correct knowledge in order to have correct faith
sports,5 4-6 lost 1 04-03 05-05 san diego padres 06 08
religion,26 6 14 4 bergland tb 25 3 3 6 0
religion,00 0 2 0 williams la 2 0 0 0 0
religion,c i don't remember for the time being what the a
religion,just as any other of the gifts mentioned in the bible
sports,worst rotation in baseball entirely replaced -- but not necessarily better
religion,this hiring by jaffe went over the head of msg inc
religion,73 60 91 -4 fedyk phi 74 21 38 59 0
sports,if he gave something up who'd he give it up to
religion,don't we have much more important uses for this wasted money
sports,the only jewish sportscaster that comes to mind is steve williams
religion,of course that might be because i am unenlightened or something
religion,however some people but not many will not like the darkness
religion,now if the question really is does god grant everybody's wishes
religion,04 2 2 0 burke har 50 0 2 2 0
sports,this is an interesting notion -- and one i'm scared of
religion,i'm sick of seeing all those white guys on skates myself
religion,if a thing is true then its converse is necessarilly false
religion,10 ecumenism - an attack on the unity of the church
religion,amos 515 says to hate the evil and love the good
sports,the cubs have some decent middlemen and so do the marlins
sports,i like hitchings am not to be found in webster's b
religion,mistakes both on offense and defense are part of the game
sports,the score is now 7-5 with xxx's team still on top
sports,matthew homes in on just the sentence that is in italics
religion,30 107 82 15 janney stl 82 24 82 106 1
sports,only a very small percentage of microlife is harmful to humans
sports,except for the brewers who you probably forgot you were right
religion,in the past lobotomies and heavey drug suppressants were common- place
religion,the key to any leafs success  will have to be clark
religion,03 78 121 9 kisio sj 77 26 52 78 1
sports,young 2b 51 13 2 1 1 7 12 9 3
sports,4% out making ability how many extra hits would go by
religion,any anthropology course should sensitize you to ritual and clean vs
religion,follow the parts that you think are suitable for modern life
sports,edu in the champion people see what they'd like to be
religion,if i'm not mistaken san jose had more wins than ottawa
religion,melchisedech offered unto thee a holy sacrifice and a spotless victim
religion,46 31 77 8 heinze bos 72 18 13 31 0
religion,28 5 122 -2 conroy phi 18 3 2 5 0
religion,06 76 185 -6 king nyi 74 38 38 76 1
religion,i've said this before but i think it's a good analogy
religion,00 0 2 -1 o'neill win 2 0 0 0 0
sports,obviously there are many christians who have tried and do believe
religion,31 21 49 -12 churla min 73 5 16 21 0
religion,otherwise i'd say we're going to win this series no sweat
religion,this excludes literalists who may otherwise be defined as biblical apologists
religion,what i'm trying to do is as usual to clarify issues
religion,i wonder where trust in the lord fits into this equation
sports,the following list of fallacies is not intended to be exhaustive
religion,in the overtime roy and hextall played like they were gods
religion,any lay person of middle eastern religion can answer these questions
sports,i infer that you mean believer in terms of having faith
religion,it seems like a pretty good set of tenets to me
sports,especially for those of us who feel the impact more closely
religion,00 0 0 0 pietrangelo har 30 0 0 0 0
religion,71 160 38 53 lafontaine buf 82 53 95 148 1
religion,in that posting i made sure i used the word public
religion,20 10 199 -14 wells nyr 50 1 9 10 0
religion,who can tell if god is really so    god is god
religion,i only turned it on in time to watch the credits
religion,89 73 94 18 chelios chi 82 15 58 73 0
religion,24 17 80 -13 odjick van 74 4 13 17 0
religion,does he represent a dogmatic threat to the principle of thelema
religion,one should endeavour to make it so if it is not
sports,if anyone finds one or starts one please let me know
religion,54 43 77 7 ranheim cal 82 21 22 43 0
sports,also the lead a pitcher enters with cannot excede three runs
sports,freemasonry is one of the allies of the devil page iv
religion,12 74 51 12 borschevsky tor 76 34 40 74 0
religion,and we easily forget that relative truth is in fact relative
religion,i recently spent some time in a christian bookstore in california
religion,romans 1016-17 but not all the israelites accepted the good news
religion,18 15 229 -51 fergus van 36 5 9 14 0
religion,the one hypostasis would be the unity of the two minds
religion,what is the proper way to dispose of old blessed palms
religion,unfortunately it's not entirely clear what the words used here mean
religion,00 0 4 0 irbe sj 35 0 0 0 0
sports,managed to win 100 games more than once peaking at 108
religion,player team gp g a pts ppg prj pim /- m
religion,they played 58 minutes of burnsian hockey to shut down quebec
sports,still counts as a back-end perfect game in my book though
religion,i will send a sample copy to any reader of soc
religion,there are certainly plenty of wierd people in the early church
religion,22 5 49 8 leach har 24 3 2 5 0
religion,i think that you are changing the meaning of values here
religion,example of head-covering in church deleted this was a good example
sports,the motto has been on various coins since the civil war
religion,59 33 36 -5 beranek phi 63 15 18 33 0
sports,i thought i was in the twilight zone for a moment
sports,what law of nature can you invoke to establish your values
religion,5 percentage of pro basketball fans who have attended college 39
sports,you're wrong since the bible clearly describes the creation as description
religion,he actually had been in charleston il up to that point
religion,49 31 111 -12 brisebois mon 68 10 21 31 0
sports,i also think too much is made of that lefty-righty thing
religion,42 22 54 0 sutton buf 61 8 14 22 0
sports,jesus deals with things hidden since the foundation of the world
religion,she has been preparing the new eden with her immaculate heart
sports,it becomes a song of praise to yhvh and of hope
religion,by now we know that this did not come to pass
religion,malmo is big enough but they also need a new arena
religion,we are living as the chinese saying goes in interesting times
religion,05 2 2 0 jablonski tb 42 0 2 2 0
religion,is connected to that ka'aba they've got in mecca 3rd cent
religion,16 4 4 0 romaniuk win 28 3 1 4 0
religion,41 32 92 5 leschyshyn que 81 9 23 32 0
religion,36 105 40 -4 juneau bos 83 32 70 102 1
religion,00 0 2 0 ciavaglia buf 3 0 0 0 0
sports,for example homosexuals must not be allowed to hold government office
religion,63 27 38 -5 kravchuk edm 55 10 17 27 0
religion,03 1 0 0 hackett sj 36 0 1 1 0
sports,does anybody have a gif of the tiger stadium seating chart
sports,i agree i reckon it's television and the increase in fundamentalism
religion,we perform these ordinances as proxies for them in their behalf
sports,faith is belief without a sound logical basis or empirical evidence
religion,there is a whistle every 30 seconds on average maybe less
sports,when did i acquire lack of belief in the easter bunny
religion,how could somebody who breaks his word be the second coming
religion,56 45 32 -1 manson edm 81 15 30 45 0
sports,who holds the record for most career strikeouts for the rangers
religion,54 30 24 7 noonan chi 61 16 14 30 0
religion,as i have posted before vatican ii lumen gentium ii n
religion,being converted to christianity means being baptized by the holy spirit
religion,myself i'm not so sure the atheists can be counted out
religion,rather i think it was considered a cesspool of all sins
religion,07 88 38 20 bradley tb 78 42 44 86 1
religion,36 8 27 -11 day har 24 1 7 8 0
sports,example of the second type there are two biblical creation stories
religion,rudolf frieling elaborates this in detail in his christianity and reincarnation
sports,but notice that even es = no is itself another idea
religion,i really don't care enough about the name change to care
sports,it is important to note the difference between these two positions
religion,does anyone know if this is true and have a citation
religion,some passages often cited on the subject probably are not relevant
sports,667 -- 6-4 lost 1 04-02 04-02 california angels 07 04
religion,now peter nyikos will explain that you're not a real christian
religion,67 41 28 -25 mcsorley la 79 15 26 41 0
religion,18 94 69 31 modano min 80 33 60 93 1
religion,there is a rite like this described in joseph campbell's occidentalmythology
sports,i guess we invaded saudi arabia during the gulf war eh
sports,wallach clearly has contributed to the over all improvement on defense
sports,gb last 10 streak home road san francisco giants 08 05
religion,no they are not guaranteed to become productive members of society
religion,the belief in mary's perpetual virginity originated long before augustine's time
sports,the 20's and 30's were the worst decades for great pitching
religion,46 19 42 4 audette buf 42 12 7 19 0
religion,are you working together with other christians to spread the gospel
sports,vizcaino is excellent defensively but is an automatic out at bat
religion,they would have described him as the god who is power
religion,25 19 44 -7 macoun tor 76 4 15 19 0
sports,weak atheism is simple scepticism; disbelief in the existence of god
sports,he has shown at least the potential of going into the
sports,or to cut all the religious crap i'm a woman thanks
religion,they might have to be content with kurri though i hope
sports,everyone else tells him this too since they've bought mary's story
religion,it looks like the b's have peaked at the right time
religion,in which it patently does not denote male homosexual activity 144
sports,this is one of my favorite fallacious points against atheism i
religion,i'm only 90% sure that it was posted to this newsgroup
religion,84 64 66 16 maciver ott 78 17 46 63 0
